,total_string
469,Will it be warmer in Saint Louis Park
470,book me a restaurant in Aransas Pass in seventeen hours
471,Is it going to be warm in Cottageville
472,show weather forecast at three am.in Wauregan
473,how's the forecast looking for supper time in Dresbach Vanuatu
474,Is it warm in Sierra Blanca now
475,"What's the weather for April 10th, 2028 in Arkansas"
476,What was the weather in my current position last October
477,Is there going to be a depression in my current location on nov. the ninth
478,Will it in hail in my current position on 12/10/2035?
479,Will it be colder in Winnebago
480,What will be the night temperate in Indiana?
481,check the weather for around nine in South Georgia and the South Sandwich Islands
482,What's the weather forecast for the area neighboring KS this autumn?
483,Weather for Jan. 7 in North Carolina
484,Weather here at two pm
485,What is the weather forecast for my current place?
486,What's the weather going to be like around Lewis and Clark Trail sixteen hours from now?
487,What's the weather in Oregon
488,"Will it get chillier in Las Lomas, British Virgin Islands on Nov. the 21st?"
489,What is the weather forecast for Winger
490,What's the weather in Wisconsin on National Maritime Day
491,Will it be colder in San Pablo today?
492,Show me the forecast for Wisconsin
493,"Tell me the forecast for Rogers City, MS"
494,Is it rainy at the Edward L. Ryerson Conservation Area?
495,What is the weather going to be like in Epleys in South Georgia and the South Sandwich Islands in 11 months
496,Will it be warmer in AMnicon Falls State Park?
497,What's the weather like today in Plankinton?
498,Will it be colder in Holladay Saint Kitts and Nevis
499,How will the weather be this month in OR
500,Will it get hotter in Hext?
501,what's the weather like in El Salvador on wed.
502,there is fog weather in Grand Lake Nebraska
503,"Find the weather prediction for Camdeboo-Nationalpark for jan. eleventh, 2037."
504,"What is the weather going to be like in Klondike Gold Rush National Historical Park on february the 28th, 2034?"
505,will there be a snowstorm in eight months at Chattahoochee River National Recreation Area
506,What is the weather forecast for Theodore Roosevelt Inaugural National Historic Site
507,what is the forecast for foggy conditions here in twenty one minutes
508,What is the humidity like in faraway on AK
509,Is cloudy in Lyncourt?
510,What's the temperature here
511,Is it going to be chilly here
512,Is it going to be cloudy in my current spot for dinner?
513,Is it hot in the current location?
514,what is the midnight forecast for Argentina
515,what is the Jan. 8 forecast for here
516,How chilly will it get here? 
517,what is the AMerican Samoa forecast for hot weather
518,"What will the weather be like not far from Alabama on May 9, 2037?"
519,will it be chilly in Cistern
520,What will the weather be in Post Falls on feb. 17?
521,Will there be a cloud in the sky in 175 days from now in Golconda in VT
522,what will the weather be like in Farmington Canal State Park Trail
523,Will there be fog in Nebraska?
524,what is the weather forecast this week close-by my current position
525,Will it colder here on 11/18/2018
526,What is the forecasted humidity in Ghana for Epiphany
527,Will it hail in Rush Valley Denmark on 6/21/2035
528,What is the predicted weather on mar. 27 for Farragut State Park?
529,"What's the weather forecast for TN on december seventh, 2026?"
530,Will it be cold this autumn in Norfolk Island
531,What is the weather forecast in the country of Chile fifteen hours from now
532,What will the weather be like tonight at Greenfoot Quarry
533,how's the weather going to be at fourteen o'clock in Falkland Islands
534,What is the weather for Yemen
535,What's the weather at my current location
536,What is the weather like in Detroit Lakes
537,"what is the weather forecast for Nassau Bay, Uzbekistan"
538,Is it nice in PW
539,"Tell me the weather forecast for eight AM in Reminderville, FL"
540,what is the ME forecast for Joanna
541,Will it be cold here in one hour?
542,Is it going to be chilly at nine am in Doolittle
543,"What's the weather forecast for East Berlin, AL?"
544,Is there a depression in Delta Junction
545,Is there any snowfall in Shubuta
546,forecast for Wisconsin at 10 PM.
547,Will it be hotter in MD on apr. 10th?
548,Is it windy in Custar
549,what is the weather forecast in 11 seconds for Frederick Douglass National Historic Site
550,What will the weather be like in 16 weeks at the Ivory Coast
551,"What's the forecast for this month in Apple Grove, DC?"
552,What's the weather forecast not far from here? 
553,Forecast in Layhigh
554,Is it going to hail in Niger
555,will it be chillier in Saxis North Dakota
556,What will the weather be like at two o'clock in El Salvador
557,In Bon Secour National Wildlife Refuge at twelve pm will it be chilly
558,Will it be hotter at nine am in Serbia
559,is it cloudy here
560,what is the forecast for Montana at dinner
561,Show me the Dresden weather forecast.
562,"Tell me the weather forecast for april 15, 2019 here"
563,What's the weather forecast at sixteen in Oklahoma?
564,will the weather be warm in August at the faraway in Micronesia
565,"Is it hot in Gold Beach, Bahrain? "
566,What's the weather forecast for Etna Green in 11 months? 
567,What's the weather in South Hill
568,Is it windy in Nauru?
569,there is warmer at Serenada
570,"When will it be warmer in White Horse, Mauritius"
571,What's the weather in Swift River Reservation
572,Is it cloudy in Vermont on 06:30:26 pm
573,Check the weather forecast for Pineridge.
574,Is it going to be colder in Botswana by 09:30
575,What's the weather in La Pine
576,Tell me the weather forecast for Missouri
577,What's the weather like in Big Delta
578,What's the weather in Pennsylvania
579,Does Wildorado have a hot temperature
580,forecast for Conrad
581,"What's the weather going to be like in Fort Point, San Francisco tomorrow?"
582,"Will it get chillier in Arkinda, Myanmar?"
583,Will it be snowy in the current place?
584,What's the weather in Taiwan
585,what is the forecast for hot temps in Ocean Park
586,what is the weather forecast for Kaaawa
587,What's the weather forecast for Porphyry Island Provincial Park right now
588,What is the weather going to be like this Evening in Arkansas
589,will it be temperate in Hybla Valley Tajikistan
590,Is it hot in neighboring Algeria
591,Is it going to be foggy at two am in Barberville
592,Tell me if the forecast will be temperate around Nationalpark Doi Suthep-Pui on 4/15/2034
593,will it rain today in Circleville
594,I want to know the weather in ten weeks from now in John N and Melba S Anderson Memorial Conservation Area
595,What is the forecasted weather for Ninaview?
596,Tell me whether Bahrain will be humid in one hour and 2 minutes 
597,"Will it be cloudy in Lenzburg, Papua New Guinea"
598,What is the forecast for 8/26/2022 in Vermont
599,Weather for here right now
600,"Will it be warmer at 15 o'clock in Deepwater, Bonaire"
601,What will the weather be like in three weeks faraway in Sompio Strict Nature Reserve
602,Tell me the weather forecast in 4 years and a half in GA
603,What's the forecast for tonight far from East Carpathian Biosphere Reserve?
604,What is the weather going to be at dinner time in the Lake Le-Aqua-Na State Recreation Area
605,Will it be chillier at my current location in one minute?
606,How is weather here?
607,"Is it going to be chilly today in Abo, WI"
608,"Will it be foggy in the same area of Parc provincial Kettle Lakes on february the thirteenth, 2018?"
609,How is the weather in OH?
610,what is the weather forecast for Shasha Forest Reserve in 43 weeks
611,Will there be a depression in the weather here on cyber monday?
612,What's the weather in the current place?
613,What's the weather going to be like near Sawtooth National Recreation Area at 2 pm? 
614,What's the weather on august seventh for Crystal Lawns Guam
615,Is it hot in Bolivia
616,Tell me the weather forecast faraway from TX
617,What's the weather going to be like here in one minute?
618,What's the weather forecast for Delaware right now
619,Weather for Beauregard IL
620,Is snowfall forecast in PA?
621,Is it forecast to be warm in Doi Inthanon National Park?
622,What's the forecast for the weather at eight am in Oxford?
623,"How is the weather in Getzville, Minnesota?"
624,Will it be hotter in Pecan Grove
625,What will the weather be in Virginia?
626,what is the forecast for the distant future in Sugar Bush
627,Will it storm in Charles Pinckney National Historic Site
628,What is the weather for my current place
629,Weather next year in Canada
630,what is the forecast for temperate weather in Bellechester
631,show weather forecast for Lewis Center
632,"Will it snow on Apr. eighteenth, 2029 in Myanmar?"
633,"What will the weather be at my current location on december the 2nd, 2029"
634,Will it get chillier in 12 years  in Greenland?
635,what's the weather going tbe twenty three minutes from now in Federico Albert National Reserve
636,What's the weather at eleven PM in Craig Mountain Wildlife Management Area
637,What's the weather forecast for Lenexa United Kingdom at 02:31
638,What was the weather last February in William A. Switzer Provincial Park?
639,"Tell me the weather forecast for Alexander, SD"
640,Will it be cold in Chatmoss Albania 8 years and a half from now
641,"Is it chilly in Charenton, NY?"
642,What kind of weather is forecast around seven pm here?
643,Tell me if it'll be colder in Steptoe Battlefield State Park in one minute
644,What is the weather like at Basaseachic Falls National Park
645,She me the forecast for Clayton Lake State Park on Oct. 17th
646,What's the weather forecast for Niue at two am?
647,what is the weather of Ludowici at 4 am
648,Will it be cloudy in Tatamy?
649,Show me the forecast for Anatone Louisiana on November 7th
650,forecast for Antelope Island and other spots within the same area
651,I need to know the weather seven weeks from now in Morgan-Monroe State Forest
652,Tell me if there will be a depression today in Kiribati
653,Tell me the weather forecast thirteen seconds from now in Ukraine
654,Show weather forecast nearby Elk City State Park
655,What is the forecast for West Virginia will it be snowy
656,Check the weather forecast for the current position.
657,what is the nearby forecast for here at 15:26:11
658,what will the weather be like in Brownfield
659,Weather for Marshall
660,Is it freezing in Kelso
661,how much rain are we getting in current position
662,will there be a cloud next year in Kewanee
663,In Morgan Mill will it be sunny
664,What will be the wind speed at the current place?
665,Will it snow in Granbury?
666,Is it warm in Vietnam
667,what is the forecast for 9 seconds from now close by here
668,"What is the weather forecast in Ulen on mar. 2nd, 2035"
669,Is it overcast in Brazil in within walking distance
670,What will the the weather be like close to Bailey's Crossroads at 05:00:34 am?
671,What's the snowfall at noon in IN
672,is there going to be snowfall in Alton
673,what is the weather forecast for Cuba at eleven am
674,Check the forecast for Natchaug State Forest
675,What will the eather be here next year
676,"What is the weather forecast for July 20, 2020 in Dachigam-Nationalpark"
677,Will it be colder here one minute from now
678,What does it feel like in Connecticut
679,what is the six o'clock forecast for West Selmont  in Montserrat
680,What's the weather forecast for Seychelles?
681,Will it be getting colder in Sahuarita?
682,Weather for my current location tomorrow
683,at 0 AM what will the weather be here
684,Will it be freezing in seven minutes in Nora Fiji?
685,Will the sky be overcast around jan. 28 in OK?
686,what is the Oct. 10 forecast for Cuyabeno Wildlife Reserve
687,Can you give me weather details for my current spot
688,What will the weather be like at 3 AM in Trinidad and Tobago
689,Weather for Park Narodowy Kushiro-shitsugen
690,"give me the weather forecast for Lower Lake on sep. 21, 2038"
691,Will it storm in North Sioux City AL
692,Is it chilly in Pixley
693,"Is there a blizzard in Tennessee Colony, KS"
694,Is it going to rain in Tonopah?
695,Will it be sunny in Occoquan Bay National Wildlife Refuge by tea time?
696,is the weather freezing in AK
697,Weather for four weeks from now in Oregon
698,what will the weather be like in Nickelsville
699,this month will the sun be scorching in LA
700,How is the weather going to be in Gambia in a week and a half?
701,what is the Orlovista forecast for midday within walking distance
702,what is the forecast for Wren for freezing weather
703,What is the weather in Kernersville Greece?
704,Will it be colder in Oswego 16 weeks from now ?
705,What will the weather be like this Week close-by Saudi Arabia
706,Will it be windy at Medicine Rocks State Park on May 24
707,Tell me the weather forecast for WY
708,Will it be stormy not far from ID on 10/2/2021
709,What is the forecast in Lono
710,What's the weather forecast for Togo on April the 24th?
711,What's the weather forecast for Arizona City?
712,"Tell me if it'll be freezing in 5 years  in Rockholds, Norfolk Island"
713,what will the weather be in Double Oak at 12 am
714,How chilly will it be at 09:32:06 am in Moncove Lake State Park?
715,What will the weather be like in Samoa at 6 pm
716,Weather for Douthat State Park on Mar. 10
717,"Will it be hotter in Conception Junction, Moldova?"
718,In UT at 7 pm will it be snowy
719,"What will the weather be in Berville AK on Feb. 6, 2017?"
720,Will it be overcast at 18 o'clock in ID
721,Will there be a depression here on october 26
722,Is it going to be sunny at five pm in Chatyrkul Wildlife Refuge
723,"What's the forecast for Spenard, GU?"
724,Is there fog in Refugio
725,What is the weather here at 7 am?
726,is Maalaea has chillier weather
727,Will it be warmer in CT
728,Will it be nice here and in the same area
729,"What will the weather be like at eight PM in Bon Air, Uruguay"
730,is it going to be cold in Readstown at 4 AM
731,What is the foggy forecast for nov. 15 in France in Brookland Terrace
732,What's the weather looking like in Macy?
733,Is there forecast to be snow in GU this summer?
734,What is forecast in Keyes Summit in New Mexico at 3 pm
735,"Will there be a lot of cloud activity next summer in Nellieburg, Arkansas"
736,Tell me the weather forecast in Greensburg
737,"Will it get rainy like last March in Hagerman, Saint Vincent and the Grenadines?"
738,will it get warmer in Centenary around the Evening?
739,"Will it be warm next winter in Smolan, Burkina"
740,Will there be fog in my current position
741,What's the forecast for IL around tea time? 
742,what is the forecast for around Putnam Lake
743,will it be hotter Netherlands Antilles Flats on april the 27th
744,Will the weather in Falcon Heights call for rain?
745,what will the weather be for Hooksett
746,what is the forecast for here fir storm conditions next week
747,Will it get hotter in the city of Ashford?
748,What is the weather forecast in Delaware
749,Is it chillier in Mint Hill FM
750,whats the forecast for Greece
751,Is it cold in PW?
752,"What's the forecast for Francisco, Netherlands Antilles around eleven pm?"
753,What is the weather at the current position
754,What is going on with the weather far from my current location
755,What's the weather supposed to be like in Elmer City
756,what is the Tal Chhapar Sanctuary forecast for cold weather
757,Will it be hot on orthodox good friday in Michigan and close-by
758,Is it cold in North Carolina
759,What is the weather forecast in 2 seconds for South Carolina
760,what will the weather be like in fourteen hours in Eastville
761,What is the current temperature here
762,Is it going to be hot in Karthaus at 7 AM?
763,"What is the weather forecast for three in Whitewood, Rhode Island"
764,What is the cloud coverage in my current place
765,What is the weather forecast for Siler City Russia
766,Is it going to be warm here for brunch
767,"Will it get colder in Camp San Saba, Latvia in one minute and eight seconds "
768,What will the humidity be like on june eighteenth in my current location
769,Will it rain in Paisley
770,Will it feel nice here or within the same area
771,What's the weather forecast for my current spot?
772,Tell me if snow is in the forecast for Teterville
773,"What will the weather be like on feb. sixth, 2024 at Blanco State Park"
774,Tell me if it will it be windy in Grizzled Squirrel Wildlife Sanctuary
775,What will the weather be like in India at 02:55:25 AM
776,"Is it cold in Breckenridge, Colorado?"
777,What will the weather be in Corcovado National Park on december the fifth?
778,Is it warm in Botna
779,"What is the weather forecast for june the third in Rileyville, CO"
780,"What's the temperature today in Griffin, NE?"
781,what is the forecast for Swain
782,What is the weather forecast in Spaulding Morocco
783,"Will it be freezing in Poland on July 5, 2032"
784,Give me the weather forecast for Zambia
785,what will the weather be in Norway at sunset
786,Will it snow in AMy
787,Is it going to get any hotter in Kerrick?
788,is AZ has chilly weather
789,"Will the weather be stormy on january the 15th, 2026 in the Federated States Of Micronesia"
790,What's the weather in Andorra
791,will it be colder in AZ than TX today
792,what is the Baotianman National Nature Reserve forecast
793,what is the weather forecast for Ridge Farm New York
794,When will it be hot in Millvale
795,What is the forecast in Wild River State Park
796,Will it get overcast in La Dolores?
797,"Is there a freezing forecast for Minto, Nicaragua?"
798,Will it be freezing in New Preston Venezuela?
799,Show me a forecast for Malaysia
800,What's the weather on Bird Island Burkina at shavuot
801,What is temperature in Benin now
802,I need a forecast for Zachary
803,How will the weather be at 8 am in CT?
804,Will it be windy at 7 AM in Dong Phou Vieng National Protected Area
805,Will it be colder 1 minute from now in Jersey
806,"Will it snow in MT on june 13, 2038?"
807,"What's the weather forecast ten years from now in Mount Victory, Macao?"
808,"Tell me the weather forecast for Huxley, MS"
809,Is it sunny in Qatar?
810,Forecast for 02:22 pm Maldives
811,Tell me the forecast for Sweden
812,What's the weather on Groundhog Day in Slovenia
813,What will the weather be in Waverly City Brazil on Purple Heart Day?
814,"Is it forecast to be rainy in Winchell, Mississippi?"
815,What is the weather forecast for Strong City
816,What's the weather forecast in Melcher-Dallas?
817,"What is the weather looking like for December the eleventh, 2034 in MD"
818,"Check the weather for Kenedy, Vanuatu for around nine am"
819,What is the weather here
820,What kind of weather will be in VA 12 years from now?
821,What's the weather 1 minute from now in Mount Nimba Strict Nature Reserve
822,"What is the weather prediction for Acworth, North Korea in six years  "
823,Tell me the weather forecast close to Romania
824,What's it feel like in North Gulfport
825,what is the blizzard forecast for 12:06 in MS
826,What's the weather for this year in Oregon
827,what is the weather forecast for Israel
828,Will it get hotter around elevenses in KS?
829,Is it warm in Vallecito
830,Is it going to storm in NE
831,Tell me the weather forecast for Casa Grande Ruins National Monument
832,Will it be warm neighboring here in Whitehouse?
833,What's the weather in Meherrin
834,What's the weather here
835,How much rain in Montana 12 months from now
836,what will be the temperature 1 minute and 8 seconds from now in Green Bottom Wildlife Management Area
837,Can you give me the forecast for 10:15 in Paraguay
838,What will the weather be like 19 minutes from now in Nepal
839,Is it going to be warm in Palmview
840,What will the weathr be in Akin Jamaica?
841,Will there be fog in Fairwood?
842,Give me the weather forecast in Zimbabwe.
843,Weather within the same area as Qatar at four
844,Is it going to get chillier near Hocking State Forest
845,Will it be temperate near Neylandville
846,Weather for Turtle River State Park
847,Give me the forecast for the weather in Citrus Springs
848,Will it be stormy in Ritchey in Palau
849,Will the weather be warm in the Nationaal park Band-e AMir at twelve am?
850,What is the temperature in Western Sahara or within the same area three seconds from now
851,what is the forecast for in eighteen minutes here for colder temps
852,Is it warm in the current spot?
853,Is it cold ever in Farristown Tanzania
854,"Tell me the weather forecast for Roseburg, Iowa"
855,What will the humidity be in Varnado Georgia at one am
856,What's the weather in Mayotte
857,Is it warm here now?
858,What's the weather far from Jarbidge
859,Will it get windy close by here?
860,what is the freezing forecast for British Virgin Islands
861,Will it be chilly in MA 12 days from now
862,weather near California
863,Is it going to be snowy here
864,Weather for Coaldale Arkansas 
865,Is it forecast to be warm in Bosnia and Herzegovina?
866,will it be a snowy day in Dalcour
867,Is there a cloud in the sky in Thornville on Feb. fifth
868,What is the weather going to be like on st. patrick's day?
869,"What will be the forecast for Belarus in the future around sep. the 22nd, 2020?"
870,will there be a blizzard in Kettleman City today
871,will it be cloudy in one minute in Jungo MH
872,What is the weather forecast now in Texas?
873,What will the weather be like in 1 hour in Bethesda
874,What will the weather be doing at midnight in Brazil?
875,What's the weather here on 2/7/2021
876,what is the overcast forecast for midday in ID
877,Tell me when it will be humid here
878,what is the forecast for in 1 second at Monte Sereno for freezing temps
879,Will it be hot near Calakmul Biosphere Reserve 3 seconds from now
880,Will it get windy this week-end in Selva Jedediah Smith?
881,Is it forecast to be temperate here?
882,Will it be hotter next month in South Dakota?
883,will the weather be colder in Naguabo four minutes from now
884,Is it supposed to get chilly in Dewey
885,Will it be freezing in 5 weeks from now in NH
886,What's the weather in the U.S. Virgin Islands
887,what is the forecast for this current position for chilly temps
888,What's the weather forecast for my current location on jun. 2?
889,What's the weather forecast for Connecticut
890,I need the weather at noon for E.A. Vaughn Wildlife Management Area
891,Will it be freezing within walking distance of Alaska?
892,Is it forecast to be chillier in Latvia?
893,"Will it be warmer at lunch in Prentice, Armenia"
894,What's the weather in Mettawa Oklahoma
895,What's the weather going to be like at my current spot at 7 am
896,what is the forecast for close to Texas
897,show weather forecast in West Crossett Luxembourg in fourteen minutes
898,what is the October 19th forecast for Iran
899,"Is it going to be warmer in Cinnaminson, North Carolina at 06:59 AM?"
900,Will it be hot in Keachi
901,what is the Cameia National Park forecast for in one minute and 1 second
902,Will it be snowy in Parnell?
903,What will the weather be in Michigan?
904,Will it be foggy now close to Jolley
905,Will it be hot here at 22 o'clock?
906,"What will the weather be like here on february 22, 2024"
907,What will the weather be in Allenwood?
908,Is it freezing this evening in Maunabo United States
909,what is the forecast for the current spot for cloudy conditions
910,Is it going to be stormy close to Australia
911,How will the weather be on May 9 in Wyoming?
912,Is it going to be windy here on Nov. 17
913,Show the forecast for two years from now in Lake Telemark Sudan
914,How is the weather right now at my current place?
915,Will it be chillier seven weeks from now in Senegal
916,Will it be rainy in Malta
917,I want to book a restaurant in 40 weeks in Iowa.
918,what is the weather forecast for Aland
919,What is the weather forecast for Laos
920,Will it rain here?
921,"What's the weather forecast for Winnfield, Georgia?"
922,"What's the weather forecast for next saturday in Granite, WI?"
923,Is it hotter now in Hicks
924,Is it going to be warmer in 2 years and a half in Deweese?
925,Will it get warmer in Berkley
926,Can you tell me the weather forecast for Samoa
927,what is the forecast for here and now
928,will the weather be warm far from Niger at 15 o'clock
929,What will the weather be in Stelvio National Park 1 hour and 1 minute from now?
930,Will it be hotter close by here at 13 o'clock?
931,what is the Fiji forecast for warm temps
932,"What will the weather be like on aug. the 8th, 2032 here"
933,"warmer condition in Haiti, South Otselic"
934,Is it going to get hotter at the Halfbreed Lake National Wildlife Refuge
935,What's the forecast for right here
936,Is there hail forecast for Hale Center on 7/22/2030?
937,Is it sunny 1 second from now in the Pitcairn Islands
938,What is the predicted weather for my current spot next month?
939,Is there snowstorm in LA?
940,what is the Pennsylvania forecast for Three Forks for midnight
941,Will it be warmer at sunrise in Jeffrey City?
942,"Will it be even hotter 2 years from now in El Jebel, Niger"
943,What will the weather be in Montserrat?
944,"Is it supposed to be windy in ME on june the 14th, 2024?"
945,"Is it cold now in Carlos, IL"
946,"On oct. 26, I will need to make reservations to eat in Halibut Point State Park."
947,Is it going to be temperate at six am in Washington
948,Is there a snowstorm coming in Dana at 4 pm
949,in 17 minutes  will it be foggy in Songimvelo Game Reserve
950,What will the weather be at thirteen in NJ?
951,what is the weather in Steward
952,"Will it be hot on december 28 in Ayr, MI"
953,Will it get windy in Ocean Breeze Park?
954,Is there a snowstorm in the forecast for Saint Helena?
955,Tell me if it'll be chilly 1 second from now here
956,what is the weather of East Portal KS
957,Is it chilly in Curacao 
