,total_string
0,What will the weather be this year in Horseshoe Lake State Fish and Wildlife Area?
1,Will it be sunny one hundred thirty five days from now in Monterey Bay National Marine Sanctuary
2,Is it supposed to rain nearby my current location at 0 o'clock?
3,"what is the forecast starting on september 1, 2039 for chillier conditions in AK"
4,how cold is it in Princeton Junction
5,"weather in Nationalpark Nevado Tres Cruces on mar. 4th, 2020"
6,"What will be wind speed in Tiplersville, South Sudan?"
7,whats the weather in GA
8,what is the weather at my current location
9,Will it snow in Haigler Bosnia and Herzegovina
10,What is the weather in Aland 4 seconds from now
11,Will it snowstorm neighboring the Rio Grande Wild and Scenic River on feb. the second?
12,what is the Sri Lanka forecast for snow
13,How is the weather going to be in Pearblossom.
14,Can you tell me if it'll be freezing in Wrightstown in seven years ?
15,Is the weather going to be colder in GU in 11 years 
16,Will there be a snowstorm at my current place?
17,Is it going to be warmer in Central Cebu Protected Landscape
18,What will the weather be in Federated States Of Micronesia at 00:17 am
19,Will it be chillier at 06:05:48 in Wagener Reunion
20,will it be colder in Cut MA tomorrow
21,"Is it going to be sunny on Oct. twenty-seventh, 2031 within the same area of this current place"
22,Will it be chilly in Fiji at ten pm
23,"Will there be a blizzard here on dec. 26, 2027?"
24,"On may the thirteenth, 2037 what will it be like in Wilderville, Montenegro"
25,Will it get warmer in the same area as Sandy Point National Wildlife Refuge
26,"What will the weather forecast be in Mount Victory, Delaware in 1 second?"
27,Tell me if it'll be overcast nearby Papua New Guinea
28,Is there rain in Nauru at 6 am
29,What is the weather like in Hebbronville Venezuela
30,What's the weather next week in Somis
31,Tell me if it'll be humid in GA one minute from now
32,Is it foggy in Shelter Island
33,I need to know the weather for San Martin
34,"Check the forecast for Fernwood, MT."
35,What is the predicted weather for Wells in Indiana?
36,What's the weather looking like right now in Croatia?
37,what is the weather forecast for Kinbrae
38,"Will it be snowy in Crouch, French Polynesia?"
39,Is it warm at seven AM in Greenland
40,"Tell me the forecast for Elderton, Indiana in 19 hours"
41,what is the weather of Sri Lanka
42,What's the weather forecast in the same area as LA in 1 minute?
43,what is the chilly forecast for Mustoe North Carolina
44,How is the weather in Birta?
45,What will the weather be next apr. in MT?
46,What is the temperate in Beltsville
47,What will the weather be like here next week?
48,What will the weather be in Nationalpark Rila on Nov. 25?
49,Will there be a blizzard in neighboring Niobrara Valley Preserve
50,Is it freezing far from here on 12/5/2032
51,what do the cloud indicate in East Aurora
52,What will the weather be this month in Wesley Hills?
53,What's the weather in Timbo?
54,show weather forcast here at 19
55,Weather for my nearby current location
56,Is there a blizzard coming tomorrow in Methuen Uganda
57,forecast for Laguna Heights Barbados
58,what is the forecast starting on 5/17/2037 for Austria for warmer temps
59,What will it be like feb. the twentieth in Colorado
60,Is the forecast colder in Idaho 1 second from now
61,"What's the weather in GU on Jul. the 4th, 2024"
62,What is the temperate in Uintah right now
63,Tell me the weather forecast 1 hour from now in Big Thicket National Preserve
64,"I need a forecast for Jetmore, Massachusetts in 1 hour and 1 second from now"
65,Will it be chillier in Portugal in one hour?
66,"What are the weather conditions going to be like in Manhasset, Vermont on Dec. the 6th, 2036?"
67,What is the weather in CT
68,Check the weather forecast for Sappho
69,What will the weather be like on September the eighteenth in Puerto Rico
70,Will it be overcast in my current location at twelve PM.
71,show weather forecast in West Wildwood South Carolina
72,"What is the forecast in Heber
"
73,What's the weather this month in Mozambique
74,What's the weather close to Cambodia at 05:44:13
75,Weather for East Peru Bolivia 3 years and a half from now
76,what is the weather like now in AK
77,what is the forecast starting at 8 pm for Alaska
78,What will the weather be in Peru?
79,What will the weather be in the current place 1 minute from now?
80,Is it warmer in Lothian Island Wildlife Sanctuary
81,will there be fog Tonight at Beamer Memorial Conservation Area
82,Tell me if it will be windy here
83,what is the forecast for 15:04 in Georgia for overcast conditions in Valley View
84,"Will there be cloud action in Saint Bernard, Virgin Islands"
85,"What will the weather be like on feb. 8, 2034 in Cedar Mountain Wilderness"
86,Tell me the forecast in the same area here on Robert E Lee's Birthday
87,Is there rain now in Maine
88,Will it get chillier in North Creek Forest?
89,"What's the weather forecast for Elida, Rhode Island?"
90,Will it be colder in Ohio
91,Is it forecast to be windy here in seven seconds?
92,"Will it be cold close-by Iowa on september twenty-first, 2025"
93,What will the weather be a nine in Willow River State Park?
94,What will the weather be here?
95,in 257 days what will the weather be like in Cannon Ball
96,"What will the weather be like 56 weeks from now, will there be sun in Tabor?"
97,What's the weather like in North Brunswick Township Virginia
98,Is the forecast windy in Nigeria on Nov. the 6th
99,"What's the wather in Coleville, Kenya"
100,Will it be freezing in the city of Sardis
101,What will the weather be like 1 minute from now within the same area of my current location
102,Will there be fog not far from Mexico on Apr. 27
103,what is the Bolsa Chica State Beach forecast for foggy conditions
104,What is the weather like right now in the same area as Georgia
105,Will there be rainfall four weeks from now in Tehama Bahamas
106,Give me the weather forecast for here. 
107,What's the weather in Niagara
108,"When it comes to Dukes and the District Of Columbia, what will the weather be in one hour"
109,Is it going to be colder in Louisiana
110,What's the forecast for Missouri around elevenses?
111,What will the weather be like in Arizona on october the 3rd
112,Is it chilly in Ecola State Park at 2 pm
113,Is the sun coming out today in Lacassine National Wildlife Refuge
114,what is the Southern Shops forecast for warm temps
115,what will the weather be within the same area of Weir Farm National Historic Site
116,How chilly is it close to Hollidaysburg?
117,Is it humid in Charenton
118,Give me Slovakia's weather forecast for eight am
119,Is it overcast in Ziwa Rhino Sanctuary?
120,what is the forecast now in Duson 
121,What is the weather like in Great Bay National Wildlife Refuge?
122,Is it cloudy in Choptank
123,Is it getting colder in Leonard Harrison State Park
124,Will it be rainy at 8 in Dans Mountain State Park
125,Is it going to get chillier in Kuwait
126,What is the weather like within walking distance of the Nationalpark Drawa
127,in 1 week is there going to be a depression in Washington
128,How warm is it in Darnestown
129,What is the weather like in Cameroon
130,"Will there be fog on March 3, 2038 in Bonaire"
131,What's the weather forecast close by Sligo?
132,What will the weather be in the Flight Park State Recreation Area?
133,What is the weather in twenty three minutes in NV
134,What is the forecast for Lesotho for starting this Fall
135,Is it freezing near Medley?
136,"Will there be a snowstorm this weekend in Bear River, Arizona"
137,what is the current spot forecast for far areas and warmer temps
138,Will it be chilly at 4 in Druid Hills AMerican Samoa
139,"Weather for jun. ninth, 2033 in San Pierre Romania"
140,Is it overcast in Bermuda
141,"Tell me the weather forecast for Molino, Washington"
142,What is the forcast now in Kansas
143,will there be any snowfall in AMerican Samoa
144,"Tell me if it will be hot on Jun. the 10th in San de Fuca, Sweden"
145,On April the twelfth in Somalia is the weather chilly
146,What's the weather in HI
147,forecast for Israel
148,What's the weather forecast for here in august?
149,What's the weather forecast for my current spot in eight hours?
150,"What is the weather supposed to be like at Sunset in Cosby, Kansas"
151,What's the weather forecast for Nishi Sonogi Hanto Prefectural Natural Park three years from now?
152,Is it cloudy in Cuba?
153,Tell me the weather forecast for here
154,"Is it warm in Califon, Tunisia"
155,Is there a storm in New Mexico in Fort Sumner 
156,"Check the weather forecast for Chisholm, Kentucky."
157,What's the weather in RI?
158,What's the weather look like for MH
159,Will it be chilly at Boggs Mountain Demonstration State Forest
160,Is it chilly in FM
161,Is it cold in the current location more than it was in 3 years 
162,What is the current weather forecast for Diamondville?
163,Tell me if it'll be colder next November in Granite-steppe lands of Buh
164,Tell me if it will storm at my current location
165,I want the weather for Saint Martin next year
166,What's the weather in South Punta Gorda Heights
167,Will it get colder in Alaska?
168,weather forecast of Lakebay 
169,What is the forecast for DE on 9/11/2035
170,Will it get cold in Nevada seven weeks and a half from now?
171,"What's the forecast for Emily, Florida for aug. 17th, 2020?"
172,What will be the humidity 5 years from now  in Bradbury Mountain State Park?
173,What is the forecast for Iceland and Danville for rain for nine months from now
174,Will it be foggy at sunset in Red Devil
175,what is the forecast for hot at ten o'clock in Idaho
176,Will it be cloudy one hour from now in my current position
177,What is the expected weather forecast for Beckley?
178,what is the forecast for the current position
179,"Will it be overcast at night in Kenmore, FL?"
180,Is it cold in Brian Head
181,What will the weather be faraway from here 308 days from now
182,"is it going to be rainy in Kings Valley, Kosovo next mon."
183,Is there snow in jan. in Castle Dale Mayotte
184,"weather in Radnor Township, WV
"
185,What will it be like in the current place at midnight
186,What will the weather be nineteen seconds from now from the Little Manatee River State Park
187,Will it be freezing on 4/20/2038 in AMerican Beach NC
188,"show cold weather forecast in five hours and 1 minute in Hokendauqua, Mongolia"
189,Is it freezing in Vega Alta
190,Can you give me the weather for here
191,"I need a weather forecast for Sao Tome and Principe on December 8th, 2026"
192,Is there a snowstorm coming to Ukraine
193,Is it cloudy in Tingley?
194,"Tell me the weather forecast for Ethridge, Maryland"
195,Will it rain 17 weeks from now in Teide National Park?
196,Will it be snowy in Pillow Indiana?
197,"What is the weather in Shenandoah Heights, Montenegro"
198,what is the 7 day for Cheat Canyon Wildlife Management Area
199,what is the weather in ND the city of Evangeline
200,Will it rain in Barberville
201,Is it supposed to be chilly in Boiling Spring Lakes?
202,is it overcast close-by in Illinois
203,Will it be chillier in La Mesa?
204,Will there be a snowfall here in the neighboring areas?
205,Will it be freezing in the current position?
206,what is the forecast for cold temps in Nevada
207,What is the weather forecast for Garrison
208,Will it be rainy faraway in Charleston Lake Provincial Park in 13 hours?
209,what is the Poland forecast for next January
210,What will the weather be like in 15 and a half weeks in China
211,What is the weather iN Gipsy-Gordon Wildland Park
212,What's the weather in Heritage Hill State Historical Park
213,weather forcast for current location now
214,What's the weather forrecast here in five seconds?
215,Is there a storm here
216,Will it be hotter in CT at 6 am
217,"Will there be a lot of wind far away from here on Sep. the twenty-third, 2021"
218,"What will the weather be in Bayside on Sep. 21, 2034?"
219,Will the weather be okay in Northern Luzon Heroes Hill National Park 4 and a half months from now?
220,Is it rainy season in Manitou Springs?
221,"What is the weather like for Fleischmanns, Lesotho 43 weeks from now"
222,Will the sun come out here
223,weather for Lowden OK
224,In NH will it be chillier in West York at noon
225,"Tell me when it will be warmer in Woods Hole, Oklahoma"
226,What was the weather like last may at Altai Tavan Bogd National Park
227,What is the weather close-by my current spot
228,at 11 am will there be a snowstorm in Fort Pulaski National Monument
229,Weather for 9/3/2034 at Bridle Trails State Park
230,What will the weather be in the current spot on 12/14/2023.
231,What is the weather forecast in Country Club Heights
232,what is the Niceville forecast in FM
233,what is the storm forecast for now in Jordan
234,"Is it currently cold in Elsmore, Luxembourg?"
235,Will it get colder in Cape Fair
236,When will it be chillier than now in South Paris in CT
237,Is there a depression going on in Uganda
238,What's the weather forecast for Sweden on Oct. the fifth?
239,"Tell me when it'll be sunny in Ralls, Marshall Islands"
240,Is the forecast windy now in Fort Myers Shores Arizona
241,Show me the forecast for 6 years from now in Westlake Village in Guinea
242,Is there a snowstorm in Russia
243,"Will it be sunny on june 1, 2021 in Bathgate"
244,Is it chilly in Nightmute
245,Will it be cloudy in Guadeloupe next year
246,Will it be stormy in Olmitz Connecticut
247,What is the weather forecast for Waipio Acres
248,"Tell me if it'll be snowy in Coastal Landscape Park on october 2, 2027"
249,What is the weather forecast for Cistern
250,Is it going to be cold today in Wing?
251,Will the weather be cloudy seven weeks from now in Hinckley 
252,What is the weather in Galena Park Oklahoma
253,Is the weather overcast here and now?
254,will it be warm at Mountainair
255,How much wind will there be in NM on november 11th
256,Is it hotter in Vernon
257,Will it be hot in my current location this week?
258,Tell me the weather forecast for my current place at 15 o'clock
259,Forecast for 11 am in Nauru
260,What's the weather in Belize close to ten pm
261,is Saint Robert hotter than Turkmenistan
262,is it warm in Fernandina Beach Slovakia
263,Tell me the forecast for breakfast at Miller's Cove
264,What will the weather be in Overton at 8 pm?
265,Will it be overcast a month from now here
266,Will there be a storm nearby
267,What is the forecast for my current place at 23 o'clock
268,Is there going to be any rainfall close to Windber in 365 days
269,Will it be overcast at lunch time in Saint Vincent and the Grenadines
270,"Weather in Grey Eagle on Feb. fifteenth, 2034"
271,Is it going to rain at my current position
272,Tell me the weather forecast for my current spot 1 minute from now
273,Can you give me the forecast for Osgood
274,Tell me the predicted weather once I travel faraway to Crimson Lake Provincial Park.
275,what is the meal time forecast for Cayman Islands
276,What is the weather like in the city of Frewen in the country of Venezuela
277,Is there a depression in weather at my current spot
278,Is there snow in the District Of Columbia
279,Is there weather going to get chilly when I get close to New York?
280,Weather for Afghanistan in one minute 
281,what is the weather forecast for Wolin National Park three seconds from now
282,Is the weather chilly in Dew DE
283,whats the weather forecast in Nicaragua
284,What's the weather in Piperton Rwanda
285,"Tell me the weather forecast for june seventeenth, 2034 in FL"
286,Is there a storm in the weather forecast for Baraga Oregon
287,Will it be sunny in Spain on 3/26/2023?
288,"Will there be cloud coverage in Verdery, Myanmar"
289,"what will the weather be in Lago Vista on October fourteenth, 2022"
290,Tell me when there will be a snowstorm in Clifton Forge
291,"is it going to be chillier in Saint Augustine, WY on may 3rd"
292,"How much hotter will it be 40 weeks from now in Blue Island, North Dakota?"
293,What's the weather going to be one hour from now in Taiwan
294,Will the weather be temperate 188 days from now in Zimbabwe
295,Give me a weather forecast for CA
296,What's the weather like here
297,What will the weather be like at me current position in seventeen seconds?
298,What will be the weather like close by Kackley?
299,Will there be a storm on Christmas Day in my current place?
300,Is there any hail in Monterey Bay National Marine Sanctuary
301,Will there be a cloud here at 06:50:20
302,Please let me know the weather forcast of Stanislaus National Forest far in nine months
303,what is the weather in Foret nationale Davy Crockett today
304,Will it be nice in Reager MP
305,What is the weather like now in Washington
306,Will it get chilly 1 minute from now in Carterville?
307,Will be it cloudy close by Azerbaijan in 55 weeks ?
308,Will it rain on sep. 25th in East Tawakoni
309,Will it be freezing close to my current location
310,Will there be snowfall this month in UT
311,whats the forecast for Redby
312,What's the weather like in Wyandotte Netherlands Antilles
313,I'd like the weather forecast for Albania
314,"What will the weather be in Rutherfordton Rhode Island on September 22nd, 2017?"
315,what is the Currituck National Wildlife Refuge forecast for chilly conditions
316,Will it be cold at 1 am in Boon?
317,Give me the weather forecast for the city of Woburn
318,Give me the weather forecast for the city of Archie
319,Will the weather be temperate 22 minutes from now in Alba
320,Will it be hotter today in Holtwood
321,Will it be overcast in Luxembourg in fourteen seconds 
322,How much sun will there be at 07:03:43 PM. in Jones Chapel?
323,Will it be chilly 17 hours from now in Cold Creek Conservation Area
324,what is the weather of LA at 4 pm
325,How temperate will it be in Blyde River Canyon Nature Reserve on jul. the 18th?
326,"which day this week will it get chilly in Palmetto, IN"
327,what is the weather forecast for Maryland
328,She me the weather in the current place for nov. the 9th
329,"Is there an expected blizzard in Brook, Tennessee today?"
330,Can you give me the forecast for Keytesville for 12 minutes from now
331,Weather for James M. Robb - Colorado River State Park
332,Will it be temperate in Tanana France in a week
333,Is it going to be nice at 6 AM at Chippewa Lake
334,Is it colder in Paraguay this morning
335,Is it forecast to be cold in Wisconsin?
336,"How will the weather be in Bettles, Aruba on may the tenth, 2026?"
337,what is the forecast for Tschetter Colony on Ascension Day in Oregon
338,How much fog is there in Hahnville?
339,Will it be snowy at the current position by March 3?
340,what is the forecast for january twenty-eighth in Kentmore Park
341,Will it be colder in Tallgrass Prairie National Preserve?
342,What will the weather be ten minutes from now in Canada?
343,What is the weather in Silver Springs Western Sahara?
344,What's the weather in Singapore
345,What's the weather forecast for Sequoyah National Wildlife Refuge
346,"Tell me the weather forecast for my current spot on dec. fourth, 2021"
347,What's the weather in Lime Ridge DC
348,Can you tell me the weather forecast for six am in Grenada
349,What is the weather like right now for Fort Adams?
350,"what will the weather be in Mascoutah, Tanzania at 09:04:38 am"
351,"Check the weather for Eagle Harbor, Tanzania"
352,What will it feel like in the current place in July
353,Is it forecast to be chilly here on july 14?
354,forecast for Hardinsburg 20 seconds from now
355,Give me the weather forecast for Wisconsin Dells in Saint Kitts and Nevis on the day after tomorrow
356,Will it be warmer at 2 pm at the Ak-Suu Complex Nature Reserve
357,What will the weather be like nine years from now in Eastport El Salvador
358,what weather is in Saint Vincent and the Grenadines on Thursday
359,what is the forecast for Lille in Norway
360,weather 1 minute from now in Camden Point Zambia
361,What will it be like in six PM at the current place
362,what is the current position forecast for starting on July 22
363,Will it be foggy here?
364,what is the forecast for colder in Anston
365,Will there be rainfall at one PM in Catahoula
366,Tell me when it'll be cloudy in Woodport
367,what is the depression forecast for in five years  in Altyn-Emel-Nationalpark
368,in two hundred forty eight days  what will MP weather be like
369,Is it going to be nice in Sandoval Belgium
370,What's the weather forecast for New Zealand?
371,what is the British Virgin Islands forecast for next november
372,Tell me the weather forecast for RI
373,Will a blizzard hit Torrey Pines State Natural Reserve on jun. sixteenth?
374,what is the Mississippi for the week
375,How will the weather be in six and a half months in CO?
376,"Let me get the forecast in Allardt, Canada."
377,is it going to be chilly on 12/13/2025 in Haugan Pakistan
378,"Will it be cold in Allardt, Aruba?"
379,What is the weather forecast 131 days from now in Atanassow-See
380,in Taiwan will there be rainfall in Willimantic
381,What will it feel like on Oct. 21 in KY
382,"What's the weather forecast for Hooven, Lithuania on National Grandparents Day?"
383,Is it going to be warm today at Saint Martin in Port Orford?
384,Will there be a blizzard next friday close in TN?
385,What's the weather going to be like tomorrow at Black Hawk State Park?
386,Will it be warm in the current place next spring
387,show weather forecast in Kenya
388,Will it be warm in Cotati in Guinea-Bissau
389,What is the weather forecast for my current position
390,What is the forecast for march the twelfth faraway from Pine Mountain State Resort Park
391,What will the weather be like 20 minutes from now in Homestead Meadows in Martinique
392,what is the forecast in North Carolina
393,What's the weather going to be like near Moldova on fri.
394,what's the forecast for my current location
395,"What will the weather be like in Port Clinton, Nebraska around midnight?"
396,forecase for Ohio in twenty one hours and one second
397,will there be rain today in Greece
398,What is the weather forecast for New Mexico
399,Will there be wind in AS
400,"Is it humid in Caddo Mills, KY?"
401,What's the weather in close by my current position
402,Tell me if it will hail in Elliotts Bluff at five o'clock
403,Will it be warm in Zambia at 9 PM
404,"Is it going to be warm on march the 12th in Pendleton, Delaware?"
405,at my current spot is it going to be hotter on Nov. the eighth
406,what is the current place forecast
407,Will it feel nicer in Finland or New Mexico today
408,Is it going to rain in Kansas by march 4
409,Will it be chilly at 11 am in Loup City
410,Tell me the weather forecast for 10/21/2024 in Metamora
411,Weather for this Winter here
412,what is the forecast for Niger
413,what is the forecast for Dr. Julian G. Bruce St. George Island State Park for rainy weather
414,Tell me the weather forecast for Croatia now
415,What will the weather be in Meeres-Nationalpark Insel Bastimentos at twelve PM?
416,show freezing forcast now within the same area in North Dakota
417,Is the weather hot in Miller House NV
418,What is the weather in Hadar
419,Will there be sun in the Manassas National Battlefield Park?
420,Ho warm is it in Arcola?
421,one hour from now what will it be like in Cholame Rhode Island
422,How is the humidity near my current place
423,What will the weather be like 1 second from now in Pugu Hills Forest Reserve
424,What is the weather forecast for Boden
425,Is it snowy in Fort Ross State Historic Park?
426,"I need the weather in Hubbardston, will it be chillier?"
427,What will the weather be here on dec. 25th?
428,Will it be warmer in Flag?
429,will the sun come out today in Houston
430,Will it be warmer at fourteen o'clock in Atlas Mongolia
431,Tell me the weather forecast for Cape Verde
432,Will it be freezing here in 9 seconds
433,"Tell me the weather forecast one year from now in Kulpsville, Togo"
434,Will there be a cloud in Kiribati
435,"Will there be a blizzard at a 4 AM  in Sky Valley
"
436,"Will it be hot in AMenia, WI?"
437,Will it be hot two seconds from now in neighboring West Clear Creek Wilderness
438,What is the weather supposed to be like in New Jersey three months from now
439,What will the weather by close by the current position at 02:02:30?
440,In Hawaii will it be warmer at 3 am
441,what is the forecast for warm weather in Carl
442,What will the weather be in one minute in Tanzania
443,"will it rain on Jan. 18th, 2029 in Kanopolis Arkansas"
444,"Will it be freezing one second from now in Aragon, Pakistan"
445,what is the weather forecast close-by Bermuda
446,is it going to blizzard at my current position
447,How hot will be there in Kanwar Lake Bird Sanctuary tomorrow?
448,What will the weather be in Totowa Guernsey?
449,Is it forecast to be stormy close to Nimule-Nationalpark 1 hour from now?
450,is Cape Mount Nature Conservation Unit has storm weather
451,I need the forecast for Mamaroneck in six weeks
452,What's the weather in Koontz Lake
453,Ethiopia Ellenton has snow weather at eight PM
454,How will the weather be in Bhutto family mausoleum next autumn?
455,will it be freezing in New Ringgold Nebraska
456,I'd like the weather forecast in Gang Mills four years from now.
457,Will there be rain in 8 minutes  in MD
458,How is faraway cloudy at 02:45 am in Brumley?
459,How will be the weather in Waltersville in one hour ?
460,Is the forecast hot in 1 hour in Leasburg ?
461,Is it going to be chillier in New Mexico this spring?
462,"Tell me if there will be a snowstorm on Sep. the second, 2028 in Olpe"
463,what is the 00:00 pm forecast for blizzard conditions in Cameroon
464,"What will the weather be at ten am in Fourche, NV"
465,Will there be a lot of wind in West Fargo GU
466,What's the forecast for Pipe Spring National Monument?
467,will it be stormy in Saint Pierre and Miquelon in the city of Wenham
468,Will it be overcast during meal time in NH?
