,total_string
1433,Congress has warmer weather
1434,What's the weather in 10 months in Nam Kading National Protected Area
1435,Will it be chilly in Liberty City Bhutan?
1436,I need to know is it freezing in MN at 01:27 pm
1437,Show the forecast nearby in twenty two minutes in French Polynesia
1438,Will it hail in 1 minute in Toms River
1439,what is the weather starting at 11:47:52 for South Africa
1440,I need a time of 21 minutes from now for here
1441,Is it cloudy in Georgia
1442,What will the weather be in Angle Cape Verde at midnight?
1443,Please give me the forecast for Branton
1444,Is there snowfall in Zec Mitchinamecus at 13
1445,Is there fog in New York
1446,Will it be stormy in MA
1447,"What's the forecast for Harper, ME?"
1448,What will the weather be like on september 26th in Eastlake
1449,What is the weather forecast for Tanque
1450,What is the weather like in Colorado?
1451,tell me the weather for next week at Cathedral State Park
1452,What's the weather going to be like in a week at Big Walnut Creek Nature Preserve?
1453,Is there going to be a depression in Point Washington State Forest
1454,"What is the weather like in Montchanin, NV"
1455,What's the weather like in Hamilton City
1456,will there be rainfall the day after tomorrow far from Rodna National Park 
1457,Will it get hotter far away in Afghanistan?
1458,Check the weather for Faroe Islands.
1459,Tell me the weather forecast for Korona
1460,show weather forecast close-by MS in 48 and a half weeks
1461,Is the forecast stormy this afternoon in Maryland?
1462,"How's the forecast for Chad on September 28, 2034"
1463,"What will the weather be on April 9, 2037 in New Brunswick Botanical Garden?"
1464,What's the weather forecast for my current position?
1465,What is the weather forecast for Nicaragua
1466,what is the forecast for Bad Branch Falls State Nature Preserve for in 1 hour and 14 seconds
1467,is it going to be humid in Helix
1468,What's it like in my current location
1469,Is there a chance of hail in Holiday Hills?
1470,what is the Eugene T. Mahoney State Park forecast for 2 days from now
1471,What's the weather in Stone Mountain Kentucky
1472,What is the weather forecast in Canfield at 22:23:22
1473,how much humidity in Mancos
1474,was the weather colder last August at Stunt Ranch Santa Monica Mountains Reserve
1475,"What's the weather forecast for North Wolcott, Alabama on october 12, 2032?"
1476,Weather for South Williamsport
1477,What is the forecast for here
1478,Will it be colder at five o'clock at the Apolobamba Integrated Management Natural Area
1479,What's the weather forecast for Oman 2 months from now?
1480,what is the forecast for here at 8 am
1481,Tell me if it'll be temperate in 8 seconds in Guatemala
1482,What is the weather looking like in Prosser on feb. the 18th?
1483,What kind of weather was forecast near Harmony Flats Nature Reserve last march ?
1484,what is the weather forecast faraway from RI seven months from now
1485,"Can you give me the forecast for 11 in Bradner, IA"
1486,"What will the humidity be like in VI on june the fourteenth, 2020?"
1487,Can i have the forecast for Bear Rocks Lake Wildlife Management Area
1488,What's the forecast for Jefferson National Expansion Memorial around eight am?
1489,Will it be colder in Colorado nine months from now?
1490,Will there be snowfall in zero PM in Estonia
1491,Will it be overcast in South Dakota
1492,"What's the weather forecast for Walsenburg, Vermont for July 13th?"
1493,What will the weather be in Mattawan Saint Barthelemy?
1494,What's the weather in Springside Nature Reserve at four pm
1495,Is the expected weather temperate here in 1 month
1496,Will there be cloud coverage at zero AM in Minami Alps Koma Prefectural Natural Park
1497,Will there be snowfall at six pm in Leisure Knoll California
1498,"Will there be hail in 8 minutes in Iroquois, MA?"
1499,Will it be hot three minutes from now faraway from Saint Croix State Park
1500,What's the weather looking like in Reklaw at 03:19:13 PM
1501,is it going to be hot here in 8 years 
1502,What's the weather in the Marshall Islands in sixteen hours
1503,"What is the weather forecast for North Carolina on October thirteenth, 2037"
1504,What will the weather be in Tajikistan on Dec. twentieth?
1505,what will the weather be in Port Costa FM will it be foggy
1506,What is the weather going to be like in Reidland New Mexico next Jun.?
1507,"How cold is it in Cargray, Argentina?"
1508,Is the forecast chillier in 1 hour in Mali
1509,Tell me if there will be wind in NE
1510,Will it be cloudy not far  from Allenton
1511,Will there be a blizzard in AR
1512,what is the New Caledonia forecast for Bagnell on sep. the 5th
1513,Weather for apr. the thirteenth in Djibouti
1514,Can you give me the weather forecast in Tajikistan?
1515,"How cold is it going to be in San Marcial, AK in one second?"
1516,What will the weather be in a month from now at my current location?
1517,What is the weather like in IA in april
1518,How windy is it in Anderson Lake State Fish and Wildlife Area?
1519,Is it going to be stormy in Austin Creek State Recreation Area at 09:42?
1520,When will the weather be temperate like it is now in Stansbury Park in Tuvalu
1521,What is the weather in neighboring OH
1522,What's the weather forecast for Spain?
1523,In Wynnedale AK will it blizzard
1524,What aree the weather conditions not far from Poneto
1525,"What will the weather be like in the Falkland Islands starting may 25, 2022"
1526,What's the weather two months from now in Arletta Malawi
1527,forecast for Thayer
1528,is it chillier at Narew National Park
1529,What's the weather in New Zealand?
1530,What will the weather be in NM in 1 minute 
1531,Will it get hotter next year in Springside Nature Reserve?
1532,What is the weather like in Phnom Sankos Wildlife Sanctuary
1533,I need a table in Uruguay in 213 days when it's chillier
1534,How will the weather be in six minutes close to Moosic
1535,"Show me weather forecast in Clontarf, KY from 4 hours from now."
1536,What will the weather be in Grand Coteau UT at six pm?
1537,Is it going to get colder at my current location by 10 am
1538,Is it going to be rainy here one second from now
1539,Can you get the weather forecast for New Baden 
1540,what is the 10 pm forecast for Sweet Springs Wyoming
1541,Is it going to snow next year in WV
1542,what's the forecast for Sai Thong National Park at 02:59 pm
1543,What's the weather in Totowa WY one minute from now
1544,"Will it be rainy this Monday in Le Center, Thailand"
1545,What's the forecast for my current place at five pm?
1546,Weather for July 1 in UT
1547,What's the forecast for AL twenty one minutes from now?
1548,Can you please give me the forecast for the Dominica
1549,will it be stormy in Wildorado
1550,Is it snowy in DeMotte MS
1551,Tell me the weather forecast for my current spot
1552,Can you tell me what the weather is like at Sam D. Hamilton Noxubee National Wildlife Refuge
1553,there is cloud in Genola South Sudan
1554,"Is it going to be freezing at tea time in Michigantown, KS"
1555,Is it snowy in Ocean Shores
1556,What's the weather in Ecola State Park in three minutes
1557,What is the weather like in Antonito
1558,Is it going to storm in Black Rock Alaska
1559,What's the weather like when you're distant from Greenport
1560,Is it nice now in Madawaska
1561,Will it be warmer now in Covenant Life
1562,Is it forecast to be chilly in Iowa?
1563,what is the Bethany Beach forecast
1564,Will it be colder in Noblesville East Timor at 3 pm?
1565,Will there be rain next year in New Hampshire?
1566,Will it be windy at 4 PM in NY?
1567,Will there be a blizzard in Egypt?
1568,Check the weather forecast for Biscay
1569,what is the forecast in Bearmouth in Virgin Islands in 3 months 
1570,How hot will it be in Wisconsin on august fourth?
1571,What is the weather like in Hurstville?
1572,Is it going to be hot in Chrisman
1573,Is rainfall forecast for Flying Hills?
1574,Can you send me the weather forecast for Malcom
1575,Will there be a depression in Wheatley
1576,what will the weather be like at ten AM in Austria
1577,Will the weather be temperate in Betances
1578,What's the weather like in Calpella
1579,Will there be a fog here this week?
1580,Will it be overcast in 1 minute within walking distance of OH
1581,Will it be hotter in Pruntytown Rhode Island
1582,I want to know the temperate from January the twentieth in Brazil
1583,Is it hot in Round Hill HI
1584,"what is the weather in current location on december the 23rd, 2027"
1585,what is the forecast for a day from now in Liechtenstein
1586,Will it rain in Deersville
1587,Tell me when it will be warmer in my current position
1588,"What will the weather conditions be in Hahntown, Wyoming at 1?"
1589,What is the humidity like in Leoti
1590,What is the weather forecast for Papua New Guinea
1591,what is the colder forecast for Nationaal park Bidoup Nui Ba in a week 
1592,What's it like in Bahrain right now?
1593,what is the forecast for Sea Isle City in Louisiana for warmer weather
1594,What is the weather like in Midfield Iowa today
1595,Will it be warm in Chicamocha National Park?
1596,How is the weather far from my current place in 42 weeks?
1597,What is the weather in the Netherlands
1598,"Weather for september seventh, 2039 in Salinas River National Wildlife Refuge"
1599,Will it hail in Villa
1600,is it freezing in Prompton
1601,"Will it be sunny in Eyota Hawaii on february seventh, 2025?"
1602,What's the weather in New Beaver
1603,Will it be colder in Oaklawn Zambia?
1604,"How temperate is it in Lopeno, Thailand?"
1605,Will it be snowy in Florewood State Park?
1606,Is it hot in FL
1607,Is it forecast to be hot in Greenland this winter?
1608,Will it be warm at Tembe Elephant Park on san jacinto day
1609,What will the weather be here at 07:08:00 am
1610,what is the forecast for assumption of mary in IN for the weather depression
1611,how's the weather in Brookdale Zimbabwe
1612,Will it be colder in Vermont?
1613,what will the weather be like in New Glarus
1614,What's the weather going to be like here at ten am
1615,Will it be rainy in Neffs
1616,Will weather conditions be stormy here from 6/15/2025 onward.
1617,what is the forecast for cloudy weather here
1618,I need to know if its humid in Greenback in Mongolia
1619,what is the MT forecast for 22
1620,What is the weather forecast for North Carolina
1621,will it be colder at midnight in Washington
1622,What is the forecast in Kearneysville
1623,Is it snowy in Audra State Park or within the same area
1624,Is it windy in June Park?
1625,what will the weather be in East New Market Antarctica
1626,Is it chilly anywhere faraway from my current place
1627,Is it going to be colder in Bonnie
1628,Give me a forecast for Carol City
1629,What is the weather forecast for four pm close to Stretch Point State Park
1630,Will there be a snowstorm in William B. Ide Adobe State Historic Park
1631,forecast for Morse Shores Kansas
1632,I'd like to know how the weather will be at 8 pm in Tennessee.
1633,Will it be foggy on the town meeting day vermont in Angola
1634,Weather in 3 minutes at Jean Lafitte National Historical Park and Preserve
1635,what is the overcast forecast for Torrey Pines State Beach
1636,What's the weather forecast for Belknap?
1637,Will there be a snowstorm around eight pm in Reed Island State Park?
1638,Will there be wind in ME?
1639,What weather will HI have will there be hail twenty one minutes from now
1640,Weather in Cairngorms-Nationalpark close from freezing
1641,How far from Quebeck will it be hot
1642,What is the weather forecast two hours and seventeen seconds from now in Elgin Schoolhouse State Historic Site
1643,What is the humidity in Serbia
1644,What's the weather at four pm in Honduras
1645,How will the weather be five weeks from now in Moneta?
1646,What's the weather for McCracken in Niger
1647,What's the weather in Kiahsville in the Cayman Islands
1648,"Will it be chilly in Milligan College, AK on law day"
1649,What is the weather forecast here?
1650,Is temperature in Hanksville freezing ?
1651,Weather on Croatan National Forest on jan. 21
1652,Want to know the blizzard weather condition in Lake Catherine
1653,What's the weather like in the Dana Biosphere Reserve six years from now
1654,What's the weather like in Forty Fort
1655,Is it going to get hotter in my current position
1656,What's the weather now in Salmon Lake State Park
1657,Is it supposed to be chillier in Favoretta
1658,What's the weather here at three PM
1659,How will be the weather condition near MI 129 days and a half from now?
1660,What's the weather going to be in jun. in Burkina
1661,What's the weather close-by Triumph
1662,"Is it warmer in Monson, U.S. Minor Outlying Islands"
1663,Is there a blizzard coming to El Verano
1664,"Tell me when it will be chilly in Chicken, United Kingdom"
1665,whats the weather in Blythewood Louisiana
1666,Please let me know the weather forecast in Louisiana state
1667,"What is the forecast for Petersville, OH"
1668,Tell me if it'll be freezing next month in Rhode Island
1669,What will the weather be in IN?
1670,is it going to be foggy in Jewell Cemetery State Historic Site 7 weeks from now
1671,What's the humidity now in NH?
1672,How much snow will we get this week in Massachusetts?
1673,What's the weather forecast near to Fern Creek this Winter?
1674,what is the storm forecast in the same area of Honduras
1675,What will be the temperate in Tyresta National Park on 7/18/2030?
1676,what is the forecast for freezing weather here
1677,Is it going to be hotter in D'Lo
1678,What's the weather forecast for Devils Den?
1679,What's the forecast far from here in Turks and Caicos Islands?
1680,what is the weather not far from current position
1681,is there any fog warning in Dauset Trails Nature Center now
1682,what is the weather forecast for La Cienega
1683,"Tell me when it'll be chillier in Cavalero Corner, ID"
1684,Tell me if it'll be freezing this year in ID
1685,Will it be colder in Connorville 
1686,I need the weather in Muncie
1687,"What will the weather be like on August 1, 2026 in Maryland"
1688,Will there be hail on 7/16/2032 in the Dominican Republic
1689,Is it humid in my current spot
1690,"What is the forecast for mar. 8th in Friesland, Tennessee"
1691,Will there be a blizzard in Chapel Point State Park or in the same area
1692,Can you give me a forecast for weather at night in my current position
1693,forecast for Samoa next sat.
1694,what is the weather forecast for Latvia Strasburg
1695,"How is the weather in Edesville, MN?"
1696,What's the weather here at 2 PM.
1697,how's the weather looking in Pheba
1698,Will it be warmer in five years  in Slemp Kansas
1699,"What's the weather forecast for Glade Park on July twenty-fifth, 2033?"
1700,"Tell me the weather forecast for Carmichaels, Gambia at one am"
1701,Is it hot in Wind Ridge Guam
1702,What is the temperature at Eifel National Park
1703,Will it get warmer in Holy Cross Wilderness
1704,"Will it be chilly in Penuelas Indonesia on Nov. 26th, 2030"
1705,"Will it be stormy on 4/3/2027 in New Rochelle, WY"
1706,Will it be chillier on october 17 nearby East Glacier Park
1707,Is it cold in Windhorst
1708,What is the forecast in the same area as Fiji
1709,I need a weather update now for Manhattan Project National Historical Park
1710,What's the forecast for KS for Jan. first?
1711,show weather while Sunset in the same area in South Carolina
1712,How is the weather going to be on child health day in Trinidad and Tobago?
1713,What's the weather like in Saint Regis Falls ND
1714,Tell me if it will rain on 4/19/2030 in Angola
1715,What's the weather forecast in the same area of ME on Apr. 20?
1716,What will the weather be 1 minute from now in Garrochales
1717,Will there be a storm faraway from Chapman Ranch?
1718,will there be s snowstorm at my current location this week
1719,What is the weather like in Long Beach United Kingdom
1720,Can you tell me the weather forecast for three o'clock in DE
1721,Will it be chilly in Oakdale OK
1722,What does it feel like in East Cove National Wildlife Refuge
1723,What is the weather in Deeth
1724,Will it be freezing at 1 AM in Balko?
1725,Tell me the weather forecast for France
1726,Will it be warm in Powersville Guam 23 hours from now
1727,"Tell me when it'll be hot in Melbourne, NJ"
1728,What's the weather in Guatemala
1729,What is the foreast for my current location
1730,"Is it going to be snowy in Concord, Utah? "
1731,Will it be chilly around Oregonia in 9 months 
1732,What is it like on 7/10/2023 in the current place
1733,Tell me if there's be a depression in Brazil
1734,What's the weather in Waretown Lebanon
1735,Will it be chillier in Suwannee
1736,forecast for Willits Christmas Island twenty three minutes from now
1737,"Tell me the weather forecast 1 hour from now for Town West, Nevada"
1738,"Is it going to be freezing in Mahwah Missouri on december the fifth, 2025"
1739,Need to see if there will be fog
1740,Give me the weather forecast for here
1741,How much humidity is there in UT?
1742,Is it going to be windy five minutes from now in NJ
1743,What is the weather in Sint Maarten
1744,"What is the weather forecast in VA
"
1745,What will the weather be like May the 10th in Rocky Boy WI
1746,Is there going to be any snowfall today in Lebanon?
1747,Weather for the night time in New Mexico
1748,Will it snowstorm in Lampi Island Marine National Park?
1749,What weather is predicted for Loyalhanna?
1750,Is it chillier in Baconton KY
1751,"Tell me the humidity index for Elizabethville, Indiana"
1752,Is it freezing at Jasmund National Park
1753,What's the weather in Blackman Jordan
1754,Weather for six am in SC
1755,weather for Frankfort
1756,Show me a forecast for French Polynesia
1757,what is the weather of Pine City
1758,what is the Bahamas forecast for stormy weather at 07:43:21
1759,What is the weather forecast for Djibouti
1760,Tell me the weather forecast for Niue
1761,what is the weather forecast close to Puerto Rico
1762,Will it be cloudy by five PM in Gobler Jersey
1763,what is the weather like in Texas
1764,Do you know if it will be chilly today in Puerto Rico
1765,Is it supposed to be chilly in DE tonight?
1766,"I need to know what the weather will be like in Gradyville at breakfast, in the state of Colorado."
1767,is it going to be hot in Luambe-Nationalpark
1768,what is the Johnson Creek forecast for chilly weather
1769,Tell me the weather forecast nearby my current location
1770,Will there be a storm in Aspinwall?
1771,What's the weather forecast in Humphrey?
1772,whats the weather in Irma
1773,what is the weather of New Jersey Palisades at three hundred three days from now
1774,What is the weather in Arkansas the city of Morrison
1775,What is the weather forecast one minute from now in Macao
1776,"Will it be warm in Gilmer, Keeling Islands?"
1777,"What's the weather forecast for Central, North Dakota?"
1778,How cold is it in my current position?
1779,What will it feel like on patriot's day on South Georgia and the South Sandwich Islands
1780,"will it rain today in French Southern Territories of Highland Beach
"
1781,Is it warm in Albania at noon
1782,What's the weather forecast for Wisconsin?
1783,What's the weather like in Serbia
1784,Will it get chillier in 2 seconds in Republic of the Congo?
1785,What's the weather forecast for 3 hours from now at Christmas Island?
1786,How will snowfall be here in 2/21/2022?
1787,Tell me if it'll be chillier now in Engadine
1788,"What is the forecast for Dec. 1st, 2036 in Keeneland"
1789,is there expected of rainfall in Horton of Connecticut
1790,What is the weather forecast for Maryland
1791,How much rainfall is there faraway from Douglass?
1792,Show me the weather forecast for the city of Spencer
1793,Tell me when it'll be hotter here
1794,How's the weather going to be on Jul. 2 in Whiteside
1795,Will it be chilly in two hundred thirteen days at Dochu-Kotsu Prefectural Natural Park
1796,Weather for now in Cape Romain National Wildlife Refuge
1797,What's the forecast for Maltio Strict Nature Reserve?
1798,what is the forecast for here
1799,Will it be hot in Dongola Cameroon
1800,"What's the weather going to be in Parkers Prairie, VA at 07:08:02 am?"
1801,What's the forecast for Castolon in French Southern Territories around seven PM?
1802,how is the weather in Mount Olivet
1803,What's the weather here in 52 and a half weeks
1804,will it get chillier within walking distance of PW
1805,Will it be warmer in my current position 
1806,What is the weather in Lloyd Equatorial Guinea
1807,What is the weather one minute from now in Ocilla
1808,Will there be sun around here?
1809,"What will the weather be in Montevallo on july ninth, 2018?"
1810,Will there be a storm six weeks from now in Albania?
1811,Will it get colder by 11 in Jacobsburg. Syria?
1812,How will the weather be this Summer in New York?
1813,"What will the weather be like here on September 17, 2040"
1814,Let me know how the weather will be in Rainelle at night.
1815,What's the weather like in Groesbeck
1816,What is the weather in Mascotte
1817,What's the weather in Pugu Hills Forest Reserve
1818,Book a restaurant 1 hour from now in Dorchester Shores Reservation
1819,weather in Bashkirsky Nature Reserve 20 days from now
1820,"Will the weather be temperate on jan. the thirteenth, 2028 at Christmas Island? "
1821,Will it be colder in Aland 
1822,Warren Island State Park distant Weather forecast for 11 am
1823,What is the forecast for Dec. 15 in Lake Woodruff National Wildlife Refuge
1824,What is the forecast for the Wildreservaat Ithala in the distant future will it be colder
1825,what is the Coulee City MT forecast
1826,"Will it be snowy on January 26th in Trentwood, Illinois"
1827,What are the weather conditions in Noel?
1828,what will the weather be in FL on 1/11/2030
1829,What is the forecast here for September 16
1830,What is the weather forecast for Monument of Lihula
1831,"Tell me if it'll be freezing 333 days from now in Caplinger Mills, Florida"
1832,I need the wather for next week in the Philippines
1833,What will the weather be like in the Bahamas eleven years and a half from now
1834,What's the weather like in Topock
1835,What is the weather going to be like in Flint Hill in 9 years  
1836,What's the weather in Paulette Yemen
1837,tell me how Bellwood weather is
1838,Payette National Forest is cold weather and have lunch within walking distance
1839,What's the weather forecast for the Northern Mariana Islands on 8/4/2024?
1840,Will there be sun ten minutes from now in Uintah
1841,How will the weather be in New Mexico around 00:09:07 am?
1842,What will the humidity be in AR in 49 weeks and a half from now
1843,Is it humid in Parc national de Killarney
1844,is it supposed to get colder here on 12/28/2019
1845,How is the forecast for OK?
1846,what is the Posey Island State Park forecast for colder temps at meal time
1847,Is it supposed to be chilly in Kuwait?
1848,"Check the forecast for Hulmeville, WV."
1849,What's the weather going to be like at 10:21:20 close by ID
1850,Tell me if it'll be chilly here at 0 pm
1851,what is the forecast for colder conditions within the same area of this current place
1852,Will it hail today in West Point at 11:36:48
1853,What will the weather be in Kokhanok
1854,"Does the forecast show a storm in Maquoketa, NH around July sixth?"
1855,what is the weather here
1856,What is the forecast for Harrison-Crawford State Forest
1857,Is fog forecast close-by to Pakistan?
1858,Will it get chillier in Sinclair in 8 hours 
1859,How much fog is there in Tarpon Springs?
1860,what is the temperate in Uzbekistan
1861,What will the weather be at Noon in Durbin OH?
1862,What will the weather be in Umatilla Malta?
1863,Tell me the weather forecast for Northern Mariana Islands one second from now
1864,Tell me the weather forecast for Sugarloaf Provincial Park ten weeks from now
1865,what is the weather of Nebraska
1866,Show the forecast for Tanintharyi Nature Reserve
1867,United States has warm weather on next Wed.
1868,will it be temperate here on 11/27/2023
1869,What will the weather be in Uzbekistan at 4 am?
1870,what is the weather forecast for Tennessee for warm temps
1871,What's the weather going to be like not far from East Timor
1872,what is the Loco weather forecast
1873,What's the weather in Germantown Hills
1874,Will there be a blizzard in Oregon?
1875,What's the forecast for nearby the current position?
1876,What is the weather in Pendleton Center
1877,what is the nine AM weather forecast for Nationalpark Midongy du Sud
1878,What's the weather like in Mountainair
1879,will it be warmer in Ristigouche Ecological Reserve on nov. the twentieth
1880,"Will be warm in Hallwood, Kosovo?"
1881,Is it overcast in South Carolina
1882,Will the sun be out close-by Admiralty Island National Monument?
1883,What will the weather be in Wakarusa
1884,How temperate will it be here this week?
1885,what is the forecast for here at tea time
1886,Will it be warm 1 week from now in DC
1887,what is the forecast for temperate conditions in Thailand in Lopeno
1888,Is the weather colder in Costa Rica
1889,Will it be colder in Delaware?
1890,"I need to know the weather for Hamorton, TN"
1891,What will the weather be in Albania at 11:56.
1892,Is it going to hail in Mount San Jacinto State Park
1893,What's the forecast for Walker Bay Nature Reserve for next year?
1894,is it supposed to be sunny here?
1895,in California will it be cold in East Trenton Heights
1896,What will the weather be in Romania at 4?
1897,What is the weather like in Wallis and Futuna?
1898,Check the forecast for Keene.
1899,Can I get the weather forecast for Benin in 32 days?
1900,What's the weather forecast in Nationalpark Banc d'Arguin?
1901,will there be hail in Kaffir
1902,What is the weather like in North Salt Lake and Afghanistan?
1903,Tell me the weather forecast for Murone Kogen Prefectural Natural Park at elevenses
