,total_string
958,I need the forecast for close by Becharof National Wildlife Refuge in nine months
959,"What is the weather forecast for Yoakum, SC?"
960,What is the forecast for this Fall in Lesotho
961,I need the weather for 7/13/2036 in Gwynedd Valley
962,"Will Mondamin be hot on July 20, 2021?"
963,What is the weather forecast for Manassa?
964,show fog conditions at 7 am in NH
965,What will the weather be in Hillview?
966,"What will the weather be like on january 16, 2030 in Rainbow Falls State Park"
967,What will the weather be in LA at 9 o'clock
968,Is it hot in Zephyrhills?
969,will it be chillier in Ruskin
970,what is the weather forecast for Piqua on Pearl Harbor Remembrance Day
971,what is MO forecast for hotter temps in Kalkaska
972,"Will it be warm in Jenners, Panama on August the sixteenth?"
973,Will there be alot of wind on March 13th in Lost Creek Bahrain
974,Will it be nice on Aug. the nineteenth in Beda Bulgaria
975,Is it cloudy in the same area of Lynn Shore Reservation
976,"What will be the weather like in Turks and Caicos Islands around dec. sixth, 2032?"
977,What is the weather forecast in Saint Vincent and the Grenadines?
978,show cloud forcast in 1 hour in IA
979,Tell me if it'll be chillier in 3 minutes here
980,Will it rain here at 13:22:09?
981,forecast for Guatemala
982,"give me the forecast for here on February the sixteenth, 2022"
983,What's the forecast for MT next week?
984,Is it going to be nicer next week in Hamel Belize
985,what is the close by Greenland forecast
986,Is it going to be sunny at 21 o'clock close-by District Of Columbia?
987,Will it snowstorm in Long Lake National Wildlife Refuge
988,"What is the weather forecast for here
"
989,What is the forecast for Farmerville in Cape Verde
990,how warm will it be in 10 minutes 
991,Is it going to be cold 21 weeks and a half from now in Salemburg
992,forecast for VI 
993,"What will the weather be like on january 2nd, 2025 in GA"
994,is it going to be cold at 4 o'clock far from here?
995,What's the weather forecast for Coats?
996,What will the weather be like in Killarney National Park on national pow/mia recognition day?
997,"Can you tell me the forecast for East Falmouth, Hungary"
998,Will it be warmer 1 minute from now at Farmington Canal State Park Trail
999,I need a weather forecast for Tallahassee-St. Marks Historic Railroad State Trail
1000,Is it going to rain here? 
1001,How cold is it in Martinique
1002,What's the weather like around Laos?
1003,"Check the forecast for Zena, Arkansas on Last Day Of Passover."
1004,Is it supposed to be sunny here
1005,Will there be any cloud in Delaware on 1/11/2040?
1006,What's the humidity right now in Aguila
1007,what is the forecast for Papua New Guinea for lunch for rainfall
1008,What is the weather now in James City?
1009,What is the weather forecast in 13 seconds  in Grand Traverse Bay Bottomland Preserve
1010,Is it going to be humid faraway from here around dinner time
1011,Is it chillier in Hong Kong than it is here
1012,What is the weather like within walking distance of the Bothwell Lodge State Historic Site
1013,Tell me the weather forecast for my current spot
1014,Weather for close-by Parc national de Kolkheti
1015,"show weather forcast for MS on jan. the 9th, 2034"
1016,What is the weather not far from Upper Klamath National Wildlife Refuge?
1017,I need the weather at eleven AM in Argentina
1018,Will it snow in my current location
1019,What will the weather be faraway in New Jersey in ten weeks?
1020,What's the weather forecast for Mansfield?
1021,will it be sunny in my current place at 6 am
1022,what is the Gearhart forecast
1023,Please check the weather forecast here.
1024,Will there be a snowstorm in Taberville
1025,Can you tell me the weather forecast for Samoa
1026,show weather forecast in East Tawakoni Italy at four PM
1027,Weather at Bystrzyca Valley Landscape Park
1028,"What are the weather conditions in Patagonia, South Africa?"
1029,"Will there be a depression at three am in Topinabee, Idaho"
1030,"What's the forecast for Fort Payne, AMerican Samoa this march twentieth?"
1031,Will there be hail around Khao Phanom Bencha National Park?
1032,What's the forecast in Stobo?
1033,What is the weather in Sehlabathebe-Nationalpark
1034,What is the weather forecast for close-by Burkina
1035,What will the weather be one hour from now in AS?
1036,What's the weather forecast for Baker City?
1037,"What will the weather be like here on dec. 8, 2019"
1038,What is the weather like in Detroit
1039,what is the weather forecast for Red Rock Lakes National Wildlife Refuge
1040,Give me the weather forecast for Nationaal park Garphyttan
1041,What is the weather close to Somesville on mon.
1042,What is the weather forecast in Langdon
1043,Hows the weather supposed to be on April eleventh close by Lyons Ferry Park
1044,forecast for Addo-Elefanten-Nationalpark
1045,Is there snowfall nearby AMerican Samoa
1046,Tell me the weather for Sewickley at twelve am
1047,"Will it be windy in Mission Bay, AK today"
1048,Will it be hot in Saint Jo Alaska
1049,what is the forecast for cold temps in West Virginia next autumn
1050,Is it going to get windy today in Tunisia?
1051,I need to know the forecast for two am in Grand Lake Towne
1052,"Tell me the weather forecast for apr. twenty-fourth, 2028 in San Diego"
1053,What is the Wauseon forecast
1054,Give me the weather forecast for Somiedo Natural Park
1055,What's the weather forecast for here?
1056,On 2/25/2025 will it be hot in Holstein
1057,What is the forecast next year in McGee
1058,What will the weather be like at my current spot on january the 19th
1059,Is it freezing in Tira
1060,Will it be warm in Kipp Rhode Island one hour and 9 seconds from now?
1061,What's the forecast for Alley. Canada?
1062,"What is the weather for Cormorant, ME
"
1063,What's the weather in Organ Pipe Cactus National Monument
1064,Will there be a lot of sun in Dry Prong Somalia at 5 pm
1065,What is the forecast at 12 am in Sudan
1066,Shoe me the forecast for Bonaire this Fall 
1067,what will the weather be like at noon in Brunei
1068,Is it forecast to be freezing in Benedict?
1069,Tell me if it will hail in Kyrgyzstan
1070,What is the weather in Port Vue
1071,show weather forecast in AS
1072,can we expect cold and freezing conditions in Glacier-Nationalpark
1073,Tell me the weather forecast one second from now in Barnum Island
1074,is it going to be chillier at 10 pm in Texas
1075,Is it freezing close to DC?
1076,show chillier conditions next week in Camp Bird
1077,What's the weather in Parthenon
1078,Please tell me the forecast for here
1079,Is there a blizzard in Stonewood?
1080,Where is Bernardsville?
1081,Will it be hotter in Wyomissing Hills?
1082,What will the rainfall be in 1 second at Roy Lake State Park
1083,How will be the weather in Cotopaxi National Park at breakfast time?
1084,Tell me if it'll be temperate three hours from now in Bonaire
1085,Please give me the weather for Federated States Of Micronesia.
1086,What is the forecast for 1 PM in Minnesota?
1087,What's the cloud forecast now for Sierra Leone?
1088,Will it be warm here in one hour
1089,what is the forecast for here one second from now
1090,"Is it supposed to be colder at lunch time in Schuyler, Venezuela?"
1091,Tell me the weather forecast close by Brown County State Park for meal time
1092,Is it supposed to gt colder in OR
1093,Will it be hotter on oct. the 20th in Massachusetts
1094,show weather forcast for February the 8th on current spot in neighboring
1095,"What is the temperature for Montserrat On Sep. the fourth, 2024"
1096,Is there a snowstorm in the forecast for El Cenizo
1097,Tell me when it will be hotter in China
1098,What is the forecast this month  in Kosovo
1099,will it be freezing 5 seconds from now  in Patmos
1100,Is it going to be temperate in Farallon Islands now
1101,Tell me if there is wind in the forecast for Roaring River State Park
1102,Will it be warm in Hematite?
1103,Weather for Oct. 16 in MO
1104,Forecast for Econfina
1105,Is there a storm in Maliau-Basin-Conservation-Area now?
1106,what is the forecast for hot temps at Bowman Bay Wildlife Sanctuary
1107,what is the weather forecast here one minute from now
1108,Weather for Carlisle Gardens AS
1109,what will the weather be at Mu Ko Phetra National Park on Administrative Professionals Day
1110,What is the forecast at four AM in Zambia
1111,"What is the weather forecast for Sep. the 14th, 2038 in North Dakota"
1112,Is it going to be chilly in Belarus
1113,what is the forecast for Orienta for hotter weather
1114,"Is it warmer now in Wetumpka, Mauritania?"
1115,weather in Tioga Colorado
1116,weather for five am in Osyka Bhutan
1117,In Portales Gambia what is the humidity this morning
1118,"What is the weather forecast for East Cleveland, Republic of the Congo"
1119,"whats the forecast for January 21, 2035 in Dubach"
1120,Is it colder today in College Park then in Serbia and Montenegro
1121,"What is the weather forecast going to be on august 15, 2038 for Hoffman Hills State Recreation Area?"
1122,I want to book a restaurant in Neshanic Station Nigeria for 06:18:13 pm
1123,What is the weather like at Emma Wood State Beach
1124,What's the weather in Singapore
1125,Will it be freezing here at 06:31:22 am
1126,hows the weather looking for Kendall Green Maryland
1127,Will there be a blizzard in Saudi Arabia around 2 o'clock
1128,when is sunrise in AMerican Samoa
1129,What is the weather forecast for Friona?
1130,Tell me what the weather will look like here at 01:50
1131,What's the weather here?
1132,Weather for Burr
1133,What's the weather this Summer in Djibouti
1134,Will it snow this week in Parc national de Petrified Forest?
1135,"What is the weather going to be like in twenty three minutes in Parksdale, IN"
1136,Whats' the weather in Fernando New Jersey
1137,What is the weather looking like right now in WY?
1138,what is a weather of Martinique a month from now
1139,What is the weather in Richardson Tanzania
1140,I need the forecast for hot in Barbados May City in 1 year 
1141,Will it get foggy in Spring Hill?
1142,In seven hours from now will it rain at my current place
1143,Will the weather be stormy in Aurora?
1144,"Will there be wind on january 24, 2019 in Ransom"
1145,Will it be stormy in distant Holly River State Park
1146,I'd like to see weather conditions for Ennis.
1147,Will it be cloudy on Sep. 16 in Palau
1148,weather on september 14 in Crofton Ukraine
1149,"What is the midday weather forecast for Chalkyitsik, Palestine"
1150,"What will the temperature be like at Fort Point, San Francisco the day after tomorrow"
1151,What's the weather in Macclenny
1152,"hot weather forecast for Pilar, Reunion "
1153,How cold will it be in Palau around fourteen o'clock?
1154,Check the weather forecast in seven weeks for Emida.
1155,what is the forecast for Sanilac Petroglyphs Historic State Park
1156,"Is it going to be foggy in Box Elder, Rhode Island"
1157,what is the Afternoon forecast for Shannon and Pitcairn Islands
1158,Will it be hotter in my current place in six weeks from now
1159,Is it supposed to be stormy in Seagraves
1160,What's the weather going to be like in PR at nineteen o'clock
1161,is hail in the weather forecast for Monterey Bay National Marine Sanctuary
1162,What's the weather forecast for Anniston?
1163,What's the weather in Paris?
1164,Is it humid in Kuwait
1165,Tell me if it'll blizzard in KS
1166,How cold is it around the current location now?
1167,What's the weather far away in Estonia?
1168,What is the weather forecast nearby SC
1169,Wuill it be cloudy in Dickson City Illinois
1170,Is it colder faraway from my current spot?
1171,How will the weather be in 11 years from now in the same area of Florida?
1172,What will the weather be like in three weeks in Gates Michigan
1173,what is the twenty one o'clock forecast for the current spot
1174,"Will it be hotter in San Valley Landscape Park on June 24, 2024"
1175,What is the forecast this evening for the Calipuy National Reservation
1176,Is there going to be a depression two hundred sixteen days and a half from now in Mill Bluff State Park
1177,Will it be stormy in Deposit
1178,what is the weather forecast for Maryland
1179,Is it going to be colder in Queen Anne on Mon.?
1180,"Is it windy in Inlet, Lebanon?"
1181,What's the forecast for Gamaliel
1182,What's the weather forecast for Pointe-Heath Ecological Reserve at midnight?
1183,Will it snowstorm next week in West Winfield Finland?
1184,Will there be snowfall in Coxs Mills Vatican?
1185,Will it be cold in Harveysburg WA
1186,Weather at breakfast in Montana
1187,What will the humidity be in Beroun on aug. 26
1188,Is there going to be any cloud cover today at McCracken in AZ?
1189,"What is the weather forecast for Colfax, Senegal on 1/1/2031"
1190,Is it foggy in Phinizy Swamp Nature Park?
1191,weather at Stanford at six am
1192,What's the weather faraway from here on sep. the fifteenth
1193,Give me the weather forecast in Boma for next summer
1194,Will it be warmer in Minidoka OK on good friday?
1195,"Tell me if it will be hotter in seven hours in Doyle, United States"
1196,Will it be warmer in Poplar Bluff
1197,"What's the weather for New York on July the 28th, 2032"
1198,Will it be snowy here soon
1199,How is the weather in Indian Creek Village?
1200,How will the weather be at 9 am in Anguilla?
1201,What's the forecast for Wendell?
1202,Will it get chillier here?
1203,Is it warm in New Jersey in 23 minutes and fourteen seconds
1204,what is the weather forecast for close-by GU 3 years from now
1205,Will it be colder in Litchfield
1206,Is it freezing in Colorado
1207,weather for MA in the morning
1208,Please let me know the weather forecast in Louisiana state
1209,"Will it be colder this autumn in Wren, Saint Martin"
1210,What will the temperature be at midnight in NE
1211,what is the forecast in Texas
1212,Will it be foggy in 1 hour and 1 minute from now in OK
1213,Weather for nearby Roselle
1214,Is it hotter close by Waubay?
1215,What will the weather be in the current position on Dec. 23?
1216,Will it be temperate next wed. in Athol in the Federated States Of Micronesia
1217,Whats the temperature not far from Valley of Fire
1218,Is the weather temperate in Millinocket?
1219,Will it storm in Kinder Russia
1220,What's the weather going to be like this autumn in CA? 
1221,What's the weather in Burns
1222,Is it going to be freezing in Lolita?
1223,Will it be humid in Beedeville on november 20
1224,Will it be nice now in Norway
1225,"Tell me the weather forecast for Inniswold, Reunion"
1226,"What's the weather like in Boca Raton, IA"
1227,Will it blizzard today in Sint Maarten
1228,Will it be overcast in seventeen minutes in the United Arab Emirates
1229,What's the weather forecast for Croatia on jul. 25th
1230,"Tell me the weather forecast for September 21, 2030 in Palau"
1231,What will the weather be like four seconds from now in South Dakota
1232,will it be cold in Carnot OR
1233,Will it get warmer in Czechia
1234,What will the weather be in Deer River?
1235,What's the forecast in Klamath Marsh National Wildlife Refuge?
1236,Will it be windy in Tequesta?
1237,what is the Random Lake forecast for hot temps
1238,what is the NH forecast for Mexican Hat
1239,What's the weather next week in Standard City
1240,what is the weather in Gem
1241,what is the PW forecast for jul. 9 in Robert
1242,What will the weather be in Cummings Mississippi in eleven years 
1243,Will it be overcast next summer not far from Redington Shores
1244,Tell me if it'll be freezing here in 21 seconds
1245,how's the weather in Mowrystown
1246,Tell me the weather forecast for Douglas State Forest
1247,What will the weather be in Palm Bay PA?
1248,Tell me if it'll be humid at eighteen o'clock in my current spot
1249,will it be colder this Saturday in NC
1250,What's the weather forecast for Moss Hill?
1251,What will be the wind speed around Pembina Gorge State Recreation Area October the 27th?
1252,will it be warm within walking distance of Saint Pierre and Miquelon
1253,"Is there a depression in Solromar on december 7, 2033"
1254,What's the weather in Castle at 17:43
1255,what is the Idledale forecast
1256,Will it get chillier in Furano-Ashibetsu Prefectural Natural Park?
1257,how much hotter will it be here tomorrow
1258,Will it be temperate in the same area in VI
1259,need a table now somewhere nearby Petit Manan National Wildlife Refuge
1260,"How cloudy is it in Morrisonville, Kentucky"
1261,what is the weather forecast for Moffett
1262,"How snowy will it be in this current place on Feb. first, 2034?"
1263,Will there be rainfall faraway from Uganda
1264,What's the weather going to be in 7 hours in FM
1265,what's the weather going to be like in Angola twenty minutes from now
1266,Will it be warmer in 20 minutes at Natural Park of Las Batuecas
1267,Will there be sun at four PM at Runkaus Strict Nature Reserve
1268,What's the weather forecast for Saint Pierre and Miquelon?
1269,"Is it freezing in Offerman, California?"
1270,Is it going to be warmer 165 days from now at Nairobi National Park
1271,"Check the forecast for the current spot in the future Oct. 19, 2037."
1272,is it going to get colder in Parc national marin Mahatma Gandhi
1273,What weather will it be in Battlement Mesa?
1274,When will it be temperate in Lansford
1275,Weather in Selinsgrove
1276,At meal time while I'm here will it be hot?
1277,Is it warm faraway in Niger?
1278,I need a weather forecast for Laos at one am
1279,"Will it storm in Texola, Delaware"
1280,What will the weather be in Lamar?
1281,What is the weather in South Bradenton
1282,Forecast for Switzer
1283,what will the temperate be here on Shmini Atzeret
1284,"What kind of weather will be in Windy Hills, Bermuda in ten weeks ?"
1285,What's the weather like in Kaltag?
1286,What's the weather forecast for tomorrow around Sankertown?
1287,What's the forecast for East Sonora Qatar
1288,Will it hail in 1 second on Riceboro Delaware
1289,Is it going to be cold once I get within walking distance of my home in New Caledonia?
1290,What's the weather close to Harmar Heights this afternoon
1291,What's the weather forecast in Guadeloupe eleven weeks from now? 
1292,Weather for Ringold
1293,Will it rain in six weeks  in Libby?
1294,What's the weather like at Powers Lake?
1295,Want to know the hot weather situation in Netherlands december 4.
1296,Is it due to rain in MH?
1297,Will there be a snowstorm in NC 6 years from now
1298,is Agnew United States has chilly weather
1299,How will the weather be different 5 years from now in Waconia?
1300,Is it supposed to snow in NV
1301,What will the weather be here 14 minutes from now within walking distance?
1302,what is the PW forecast for stormy weather
1303,Is the weather hotter in Old Furnace State Park
1304,What's the forecast for North AMityville?
1305,Weather for Swaziland
1306,What will the weather be like in twenty two minutes at San Pasqual Battlefield State Historic Park
1307,Tell me the weather for Comertown
1308,What's the weather forecast for Crystal Lake Park?
1309,Need weather forecast for Stacy in Vanuatu 
1310,What's the forecast for my current spot
1311,What's the weather forecast for here?
1312,Will there be a blizzard at 2 am in my current place
1313,What's the weather forecast for MI for August 20th?
1314,Tell me the weather forecast for Equatorial Guinea
1315,Is it freezing on Jun. the 21st in Apshawa South Africa
1316,Weather for noon in CA
1317,"Is there any predicted snowfall in 2 months in Vandalia, El Salvador"
1318,How will the weather be in Kentucky this week?
1319,Is it supposed to hail in NY
1320,Weather for Knierim Kansas in twelve weeks and a half from now
1321,"How's the weather in Grisdale, Bangladesh?"
1322,what is the forecast for hot temps in Kuwait in Augusta Springs
1323,Tell me the current forecast for Switzerland
1324,Tell me if it'll be hotter a week from now  in Waxhaw
1325,Will it still be warm nineteen hours from now in PA
1326,"What is the weather like in Roeland Park, Guadeloupe?"
1327,Tell me if there will be hail at tea time in Nordland
1328,Is it better in Holi or here
1329,will it be sunny a lot in Honduras next autumn
1330,Will it be cold in Wheatley Provincial Park?
1331,What is the forecast on 12/9/2039 at Florida Caverns State Park
1332,what is the warm forecast for Newburyport New Caledonia
1333,Is there a lot of sun in Qatar?
1334,What's the forecast for Belize around meal time?
1335,Please tell me the forecast for Guinea-Bissau
1336,show weather forcast for T.H. Stone Memorial St. Joseph Peninsula State Park on one hour from now
1337,Is it warm in West Monroe
1338,"Can you give me the weather forecast for Nov. 9th for Lakeview Heights, LA"
1339,"Can you tell me what the weather is doing in North Epworth, Guam"
1340,I need the weather in ND in three hundred fifty one days 
1341,Will there be a blizzard at seven in Colorado
1342,"Will it be hot in West Union, Malaysia"
1343,Will it get cold in Nationalpark Mu Ko Phetra?
1344,Weather for Faroe Islands
1345,is it going to be warm here
1346,How is colder in City of Rocks State Park around 03:43 pm
1347,How humid is it in Paducah?
1348,in Khlong Phraya Wildlife Sanctuary is there a cloud
1349,Will there be snowfall in KY?
1350,"What is the weather forecast for Naches, Sierra Leone"
1351,what is the forecast in Mer Rouge and Palestine
1352,When will WI be temperate?
1353,Is it going to be hot in Lexington-Fayette
1354,"Will it be hot in the Cayman Islands on November 12th, 2035"
1355,"Is it going to get chillier at 5 am in Trussville, Bosnia and Herzegovina?"
1356,What's the weather forecast for Sidnaw at 20 o'clock? 
1357,show weather forecast for Dovre-Nationalpark
1358,Let me get the forecast for tea time in El Salvador.
1359,What's the weather forecast for Haigler?
1360,Will it be sunny in South Superior?
1361,will the weather be cloudy at 0 PM at my current position
1362,what is the forecast for Chandler
1363,"Will it be hot in New York on october the 1st, 2026?"
1364,Is it hotter here on Navy Birthday
1365,"Give me the forecast for feb. eleventh, 2034 far from Alaska"
1366,"Tell me if it'll be rainy here on Dec. the 25th, 2033"
1367,What is the weather forecast in Brunei
1368,What will the weather be in Croatia?
1369,What will the weather be in Catahoula National Wildlife Refuge?
1370,what will the weather be like in Louisiana will it be colder then now
1371,is it going to be chilly in Western Sahara in 13 hours
1372,"Will there be a snowstorm in Slick, OR four hours from now?"
1373,What's the weather in my current spot the day after tomorrow
1374,What is the forecast for Sanibel
1375,"Is there a blizzard coming to North Bonneville, OH around 10 o'clock?"
1376,What is the weather doing in South Carolina right now?
1377,Is it going to be freezing in one hour in Puerto Rico
1378,What will the weather forecast be during the Kent State Shootings Remembrance in El Cocuy National Park?
1379,What is the weather in Taiwan
1380,What is the weather forecast for Sunset in Bouvet Island?
1381,Can you tell me the weather conditions for Patricia
1382,"What will the weather be like in Lambertville, India at ten pm"
1383,Will it get hotter in Zenith CT?
1384,Will the weather close by be warmer in Kentucky
1385,What's the weather like nearby in Rhode Island?
1386,What will the weather be in Worthington Springs?
1387,What's the weather in Dazey
1388,What will the weather be at nine am in HI?
1389,"What's the forecase for Inverness on February 5th, 2031?"
1390,Is there rain in Afghanistan
1391,Will the weather be the same here in one week in the same area
1392,"will there be hail in Dean Creek Wildlife Area on Feb. 25, 2031"
1393,Give me weather information for Porcupine Mountains
1394,Will it be rainy nine weeks from now close to the Matlacha Pass National Wildlife Refuge
1395,Will it be raining one hundred thirty days from now ion Gobles Canada
1396,Is there supposed to be snowfall at zero o'clock at Parc national Alerce Andino or anywhere distant
1397,what is the Lualualei forecast for one minute from now
1398,Will it be freezing nearby Thap Lan National Park at 4 pm
1399,"What's the weather forecast for Aug. 8, 2020 at my current location?"
1400,What's the weather forecast for next week at my current position?
1401,"Will there be a storm in Palm City, WV?"
1402,What is the humidity in Missouri City SC
1403,Is it hotter here
1404,"Give me the weather forecast in Pleasant Dale, Alaska starting in 19:52"
1405,Will it be hot during Winter?
1406,What is the weather forecast in nine months within walking distance of Ohio
1407,I want food in Zaleski
1408,What's the weather in twenty five days in Hagerman National Wildlife Refuge
1409,what is the forecast for 6 am in Aruba
1410,At thirteen hundred hours what will the weather be on Ghana?
1411,Is it chilly in Alaska
1412,What is weather in Azerbaijan 16 seconds from now
1413,Is it chillier here
1414,"What is the temperate in Seattle Heights and Slovenia at seven pm.
"
1415,"How is the weather going to be this week in Roseau, IA."
1416,What's the weather in Mountain Center
1417,Will it be cold in Boyertown New Zealand in eighteen hours 
1418,What will the weather be in Bernie ID?
1419,What's the weather like in Ojo AMarillo
1420,Is it hot here
1421,What's the forecast for Georgia?
1422,Will there be a blizzard in White House Curacao
1423,Will there be snowfall in Kitlope Heritage Conservancy
1424,Will it be windy at two PM in France?
1425,Will there be depression on Mar. the twenty-eighth in Saint Pierre and Miquelon
1426,what will the weather be in four weeks around Tsingy de Bemaraha Strict Nature Reserve?
1427,Will there be wind in Loyola?
1428,What's the weather forecast for breakfast time in Palau?
1429,What's the weather like today in Sierra Blanca
1430,Tell me if there's a snowstorm in the forecast twenty seconds from now in Holtville
1431,What's the weather in Stamps
1432,what is the 11 pm forecast for here and far
